,combined_text
996,extinguisher fire triple dry chemical lb extinguisher fire abc dry chemical lb ul rating with wall bracket generated by reorder am
997,ethanol sun coast contract
998,tiles acoustical building materials july purchase of ceiling tiles wo
999,elbows pvc sewer spicot end degree rc ln qty delpf bodel date act material for awwbsc
1000,ambulance cots and stretchers xps mattress grated bolster mattress qty xps mattress grated bolster mattress
1001,head ear eye and face protection safety glasses for tyrone bethal safety glasses for tyrone bethal
1002,lights emergency gt distrheadlight flasher gt
1003,battery volt marine deep cycle ah type agm qty ea battery volt marine deep cycle ah type agm battery
1004,asphaltic concrete hot mix in accordance with it apac texas hot mix special projects
1005,cable type xlp with neutralbrenaulinked polyethylene insulated urd type maximum conductor operating tempera ture is degrees celsius in wet or dry applications on qualified products list reel shall be nonreturnable wood max flange measurement and max outside to outside width measurement inch arbor hole this dimension must be maintained even with the use of the pressed in metal hub purchasing footage shall be ft critical materials supply arrangement cmsa
1006,diphenhydramine hci injection usp single dose diphenhydramine hci injection usp single dose ml carpuject with luer lock hospira ndc medical supplies
1007,boot steel toe steel midsole size rc ln qty del pf bo del date material needed at awbsc
1008,flags flag poles banners and accessories flags for abia
1009,transmitters pressure flow level etc copperhead cobra blue test station item on the bid sheet hdpe for construction rehab
1010,parts greco paint sprayer greco or equal ea line lazer striper complete spray system with tips this equipment shall be provided in accordance with pathmark traffic products of texas quote submitted by salesperson on deliver to guerrero park grove blvd austin tx pard contact person is kerri thompson or joe diaz paint striper
1011,detergent liquid dishwasher gal cont rc ln qty del pf bo del date material needed at wbsc
1012,shirts dress mens or womens cotton long long dress shirt for chief kerr white shirts for chief kerr
1013,janitorial supplies general line aw facilities for janitorial order
1014,nameplates plastic name plates
1015,battery penlight size aaa rc ln qty del pf bo del date material needed at wbsc
1016,twoway radio supplies parts and accessories n male tessco see attached
1017,wire guy extra high strength wire guy steel galvanized class a inch extra high strength footcoil this steel shall comply with astm latest edition application to the grades and sizes listed on qualified products list for ftcoil order item critical materials supply arrangement cmsa
1018,suspenders firefighter red replacement suspenders wquick release buckles hfr no hfr no hfr no replacement suspenders
1019,regulators voltage current voltage regulator phase v kva in accordance with specification on qualified products list voltage regulators
1020,electronic publications directories dictionaries encyclop overdrive inc downloadables gf
1021,corrugated boxes and sheets including fillers supply and delivery of record storage boxes box price ea storage boxes and map tube box
1022,lighting system spotlightsstrobe lights battery kits for trailers spotlightsstrobr lightsbattery kit for trailers
1023,furniture office furniture purchase not included in citywide
1024,sign for lockouttagout program marked danger rc ln qty del pf bo del date material needed at wbsc
1025,medical dental and lab supply per price agreement medical supplies medical supplies
1026,arresters lightning arrester riserpole kv mcov metaloxide type top terminal supplied wnut wire clamp and protective cap mounting hardware shall be insulated base bracket with isolator lower terminal shall be isolator nut washer and threaded terminal nut arrester shall meet ansi standard latest version for metaloxided surge arresters per standards committee begin stocking this arrester this stock item replaces which will be removed from stock as soon as we have suffcient stock of this arrester in qpl critical materials supply arrangement
1027,bag plastic liner gallon x rc ln qty del pf bo del date material needed at wbsc
1028,shoes safety toe safety shoes
1029,pliers combination in rc lnqty delpfbodel date material needed at awgbsc
1030,street light poles and standards street light decorative pecan street assembly mh black contains fixture pole arm washers lens per ae dwg no eslps and ae all hardware shall be stainless steel and tamper resistant ae stock number approved manufacturers amerlux pn to antiq stlamp pn manufacturer acuity pn px lab qsm per mog arf qsm st mr
1031,fuses fuse blocks and holders links etc kramer irby
1032,manholes and manhole covers frames grates ring lavaca st beto reyes manhole manhole
1033,transformers power distribution incl fluid fill transformer padmounted phase feed thru switch dead front kva in accordance with specification on qualified products list design forecasted jobs
1034,sodium hypochlorite concentrated liquid sodium hipochlorite various locations sodium hipochlorite various locations
1035,envelopes plain special order cases or regular window envelopes per thousand for controllers office central accounts payable section reg window envelopes for ap
1036,monitors color and monochrome environmentally certified precision and monitors rebecca alvidrez cc
1037,lights emergency tomar amber led all americas sales tomar for ae see attached
1038,shredders paper fax to attntpass coop this equipmentsupplies shall be provided in accordance with grainger quote submitted by james leiskau on reference txmas contract expiration grainger paper shredder planning
1039,poles embedded steel pole steel galvanized per spec ft length change commodity group and commodity code from to dkokas wr
1040,emulsions asphalt various sections
1041,patch texas dept of health emergency medical technician replaces texas department of state health services fire emt and paramedic
1042,work clothes new hire lance foster uniform new hire lance foster
1043,lights emergency gt distributors see attached
1044,monitors color and monochrome environmentally certified quote ems dell monitor ems dell monitor
1045,concrete gravel mix lb sack rc ln qty del pf bo del date ordering concrete for glen bell
1046,circuit breakers load centers boxes and panelbo price allowance for a pole dc circuit breaker to amp aic these circuit breakers will be used as branch breakers in amp dc panelboards purchased under item number update short and long description per roy priebe noble jones ac and dc panelboards for nw ly eb and ad subs
1047,cable power type xlpe awgalumfull acsr neutralxlp deg c max operating temp wire shall be furnished on nonreturnalbe wood reels max flange measurement and max outside to outside width measurement shall be inch arbor hole this dimension must be maintained even with the use of the pressed in metal hub purchasing footage shall be ft on qualified products list inch arbor hole this dimension must be maintained even with the use of the pressed in metal hub critical materials supply arrangement cmsa
1048,twoway radio supplies parts and accessories pn motorola parts sns attached
1049,fingerprinting equipment accessories and supplie rolls austin police department red breakaway evidence tape inch x inch roll with custom imprint evidence austin police department in black letters part no ster apd each plus set up fee forensics apd evidence tape
1050,stop curb for iron pipe in rc ln qty del pf bo del date materials needed at glen bell warehouse
1051,hardware accessories mounts patches plates sea troy products console slope level rear lone star products see attached
1052,twoway radio supplies parts and accessories motorola quote motorola portables
1053,twoway radio supplies parts and accessories dual band mhz phantom antenna nmo black mfr laird technologies mfr pn tessco see attached
1054,twoway radio supplies parts and accessories motorola control seal rz communications see attached
1055,channels steel connector bronze parallel with cable separator bar for copper conductors mcm bolts one longer than the other on qualified products list critical materials supply arrangement
1056,telecommunication parts and accessories not other chatsworth products inc cpi universal horiz cable mgr snglsided black quote contract cables and power supplies
1057,air conditioning and heating parts and accessories fy pats sheet metal shop fy pats sheet metal shop
1058,parts and accessories flowmeter system awrs liter bottle kit part ref quote hach sampler bottles
1059,laboratory gases argon carbon dioxide helium h per specifications acetylene helium oxygen
1060,floor maintenance machines parts and accessories each swivel caster each bumper wheel each squeegee blade front each squeegee blade rear each ure door seal each ure door seal each filter panl pm labor shop supplies disposables each knob star abia floor equipment maintenance and parts
1061,antennas and accessories amplifiers brackets ma unity fiberglass tessco see attached
1062,rusch slick set endotrachael tube rusch slick set flexiset endotrachael tube with stylet inside uncuffed mm inside diameter in length rusch teleflex item number medical supplies emergency patient care for stock
1063,shoes safety toe safety footwear
1064,engines diesel automotive and replacement parts crp for cummins engines
1065,jacket supershell emergency response lr jacket with sgt stripes and jacket with corporal stripes firm order apd andy allen
1066,monitoring equipment security closed circuit fo ea camera smoke video surveillance pelco security system surveillance parts max po
1067,audio visual equipment and supplies not otherwise peerless smartmount universal flat panel tv cart cart mfg part unspsc contract njpa technology catalog quote h f r stands for videoconference tv library
1068,engines and parts helicopter adapterend part no american eurocopter no substitute replacement parts for ec helicopter
1069,hooks drive rod ground inch x ft inch copperweld on qualified products list critical materials supply arrangement
1070,cutouts pole line type cutout shall be rated amp continuous current for operation on a system cutout shall be polymer with a bil cutout shall have an interrupting rating of symmetrical asymmetrical cutout shall be designed to be interchangeable with other manufacturers fuseholders fuse tube liner shall be synthetic bone fiber material or approved equal cutout shall utilize a linkbreak lever to mechanically break fuselink element will replace item upon cutover completion dp on qpl and add per specification critical materials supply arrangement
1071,packing gasket pump packing for water pump rb
1072,hammer machinist cross pein whandle lb rc ln qty del pf bo del date material needed at awwbsc
1073,work clothes workshirts for ae employees invoice no buyer dolores castillo workshirts for ae employees
1074,lights emergency universal led dome light round w red night light volt white lens white leds new design lone star products see attached
1075,lugs compression type and soldering type lug compression nema two hole rated for aluminum copper acsr tongue width to be no greater than in with in holes to accomodate in bolts on qualified products list per new dcs standard this item will replace cutover date is does not fit cable properly per gary noble critical materials supply arrangement
1076,epinephrine injection usp abbott labs epinephrine
1077,monitors color and monochrome environmentally certified ticket quote ctm dell
1078,meters indicating and recording of power consumpt sleeve meter socket disconnect fabricated from inch mylar polyester clear film temperature resistance to f dielectric strength volts on qpl generated by reorder am
1079,tee brass x x in rc ln qty del pf bo del date material needed at awgbsc
1080,cutter tubing brass cop to in rc lnqty delpfbodel date material needed at wbsc
1081,cable accessories clamps clasps clips closures clamp hot line tap body extruded alum screw and concave pressure pad extruded alum stainless steel screw that holds concave pad to main screw aa main tap cual pre filled with oxideinhibiting compound in qualified products list qpl generated by reorder am
1082,shirt t ash ls size stock
1083,parts farm tractor misc brand listed or equal testadjust injector pump on tractor testadjust injector pump on tractor
1084,bags and liners plastic garbage can liners jani microfiber red mops natural liners
1085,nameplates plastic one line name plate ordered each office name plate order for sworn and civilian
1086,aggregate trap rock per ton vulcan construction materialstrap rockseal coat i
1087,fingerprinting equipment accessories and supplie item white evidence box tape inch x inch roll with imprint evidence in black letters qty rolls per roll total please ship to the attention of eric garza white box tape
1088,welding and industrial gases acetylene argon ca industrial gasses for apd forensics lab helium compressed gas ultra high purity cuft each hydrogen compressed gas ultra high purity cuft each industrial gases for apd forensics lab
1089,twoway radio supplies parts and accessories whip antenna cellpcs nmo roof mount tessco see attached
1090,oral airway hudson rci size latex free oral airway size mm cathguide guedelstyle latex free single use nonsterile hudson rci item number medical suppliesemergency patient care for stock replenishe
1091,protectors lightning lightning protection system air terminal enhanced dynasphere mast dia alum without base coupler to tape or cable lug connection base galv cantilevered cadweld mold cable to horizontal lugbus box cadweld weld cadweld card cloth cable cleaning mold cleaning mold handle mold lightning event counter the erico component part numbers are as follows part no dsmkivss part no part no termlugcoupl part no part no part no part no part no part no part no leciv all materials shall be as per qpl obsolete esdeast setup wrong storeroom dkokas generated by reorder am
1092,twoway radio supplies parts and accessories pn motorola radio
1093,lights emergency tomar remote sirenlight control all america sales see attached
1094,axe sngl bit complete whandle lb rc ln qty del pf bo del date material needed at webberville warehouse
1095,phonograph records sound tapes etc prepared cds baker taylor gf cds
1096,lid water meter for small round bx rc ln qty del pf bo del date material needed at awbsc
1097,valve gate di flange mech jt in rc lnqty delpfbodel date material needed at wbsc
1098,application software microcomputer green building program webbased document project management application june thru june buyer art acuna software and services
1099,vaccines boxes mmr mmr ii mmr all sdv merck vaccines boxes diluent mmr sterile merck vaccines mmr vaccine and diluent
1100,bushing brass x in rc ln qty del pf bodel date delivery date shall be no later than fortiline material for awgbsc
1101,radio frequency scanner receivers and amplifiers installation rfid detection system model rfid
1102,microcomputers handheld laptop and notebook quote public health precisions workstation public health precisions workstation
1103,arms mast base cast aluminum breakaway for use on poles access door and vandal resistant fastener with tool fastener shall be stainless steel overall height each base shall be furnished with od x id x thick steel washers and x idx thick steel washers and x stm bolts with hex head nuts grade h lock washers and flat washers for connecting pole to base hardware shall be packaged separately and shipped with each base base shal be manufactured per ae drawing top is slotted dia bolt hole circle and bottom is slotted diameter bolt hole circle bolt pattern on qualified products list kramer jit idle stock review per tbreeding dkokas kramer idle stock reviewremove per breedingkokas generated by reorder pm
1104,engines and parts helicopter each screw part no american eurocopter helicopter parts
1105,emulsions asphalt ergon
1106,work stations modular systems furniture abf quote dated office furniture
1107,pole line hardware anchors arms bolts braces plate pole eye ductile iron hot dipped galvanized for wood poles lbs ultimate strength on qualified products list critical materials supply arrangement
1108,projection devices and accessories enviromentally certified grayprojector
1109,conduit and fittings aluminum connector transformer tank grounding solid to stranded bronze shall accommodate unbroken ground wires side loading on qualified products list cross reference note replaces bill g critical materials supply arrangement
1110,lights emergency corners fr total fronts takedowns rear work warning digital cable tomar lectronics see attached
1111,ethanol sun coast contract
1112,pipe pvc water pc psi rc ln qty del pf bo del date material needed at awbwsc
1113,hypochlorite sodium for control of slime and alg dessau river place and harris branch bleach
1114,antennas and accessories radio only brackets m antenna mhz n male connector uv stable polycarbonate base rated for outdoor use molded makrolon polycarbonate base radiator is stainless steel rod with chrome finish nickel plated brass bushing used with item capacitor control timetempvoltcurrentkvar generated by reorder pm
1115,power supplies computer room ml power supply vac powermaticswalnutcreek
1116,diesel fuel motor fuel ultra low sulfur diesel biodiesel sun coast october
1117,epi auto injector adult dose epipen epinephrine injection autoinjector adult dose dey laboratories medical supplies
1118,conduit polyvinyl chloride sch rigid in coupling pvc degree angle inch for eb and db conduit with one belled end in accordance with nema latest edition on qualified products list generated by reorder pm
1119,gun grease multiload no c rc ln qty del pf bodel date delivery date shall be no later than grainger material for awwbsc
1120,rescue equipment supplies and accessories includi pr wildland gear for cadet class buyboard item helmet wildland yellow full brim ratchet suspension nfpa qty item wfb goggle ess wildfire antifog antiscratch qty item protector earneckface nomex with fr cotton lining shroud for bullard wildland helmet qty item chinstrap wildland nomex quickrelease qty ea item coat osx wildland indura cotton with lazermax yellow size large qty item coat osx wildland indura cotton with lazermax yellow qty item coat osx wildland indura cotton with lazermax yellow size med qty item coat osx wildland indura cotton with lazermax yellow size xl qty item coat osx wildland indura cotton with lazermax size large tall qty freight reference quote pr wildland gear for cadet class buyboard
1121,wiring devices adapters caps connectors extens connector aluminum vise type extended range aa to aa each connector shall be prefilled with corrosion inhibitor on qualified products list replaces csn critical materials supply arrangement
1122,office supplies general pr quote various cubicle parts attn eddie martinez cubicle parts
1123,nails box cement coated staples ground mounding x x hot dip galvanized rolled point on qualified products list critical materials supply arrangement
1124,emulsions asphalt ergon asphalt and
1125,pole line hardware anchors arms bolts braces arm static hot dip galvanized steel ft on qualified products list kramer idle stock reviewinsurance per weisebreedingkokas generated by reorder am
1126,blades asphaltconcrete cutting diamond tipped diamond blade warehousetyler blades
1127,tape insulating electrical tape high voltage linerless rubber inch x foot roll use as per oem specifications brand only other manufacturers type will void switchgear warranty pn ae to use brand only other brands willvoid entry rolls per box must meet specification manufacturer pn generated by reorder am
1128,reflective sheeting pressure sensitive type black yds acrylic filmtransparentelectronically cuttablenon perforatedpressure sensitivegroup reflective sheeting sign material purchase off ma for a total amount of ship to jessie st austintx call anthony serrano hours prior reflective sheeting sign material
1129,twoway radio supplies parts and accessories motorola connector mini uhf rz communications see attached
1130,irrigation systems supplies parts and accessori weathermatic nozzles irrigation parts for abia max po
1131,torch cutting heat gun files torch head truck copeland
1132,tools and supplies strappingbundling lumber expansion joint chamfer ranger hats hammer ace contractorconcretelumber expansion joint chamfer
1133,reducer brass x in rc ln qty del pf bo del date material needed at awgbsc
1134,trouser uniform cotton nfpa men plain pockets fire shirts and pants special shirts
1135,street lighting luminaires accessories and parts repair to electrical outletsblk
1136,pliers linemans side cutting in rc ln qty del pf bo del date materials needed at glen bell warehouse
1137,relays electronic darralyn buyer part number sel reference relays
1138,rusch slick set endotracheal tube rusch slick set rusch flexiset endotrachael tube with stylet inside cuffed sterile mm inside diameter in length sterile latex free single use color coded stylet each per box rusch medical part number or buyer approved equivalent medical supplies
1139,video and audio systems accessories parts closed circuit shells as per anixter quote terms and conditions governed by debora anderson buyer i shells
1140,pole line hardware anchors arms bolts braces anchor bolts
1141,hydraulic pumps hand and motor driven power unit power equipment for
1142,readymix concrete ready mix concrete
1143,diphtheria tetanus toxoids pertussis vaccine tpass contract tdap vaccines
1144,trousers uniform cotton nfpa womens plain pockets fire blue shirts and ladies pants
1145,coupling brass comp gj x comp gj in rc ln qty del pf bo del date material needed at awgbsc
1146,conduit steel liquidtite flexible splice compression full tension aluminum body prefilled with inhibitor for mcm strand all aluminum conductor on qualified products list critical materials supply arrangement
1147,janitorial supplies general line octdec gulf coast supplies bsd sites octdec gulf coast supplies bsd sites
1148,letteringretroreflective limeyellow ems paramedic blauer jackets
1149,hat safety full brim rc ln qty del pf bo del date material needed at wbsc
1150,emulsions asphalt ergon
1151,parts and accessories domestic water treatment oring bunan replacement parts for chem feed equipdavis wtp
1152,logging devices electronic longrange data colle odalog hydrogen sulfide gas data logger hydrogen sulfide data loggersjeff betts
1153,microphones and related equipment chestsets earp model supraplus monural toppart no plantronics headsets other equipment and accessories at off plantronic gsa schedule headsets
1154,paint spray marking fluorescent red inverted can rc ln qty del pf bo del date material needed at wbsc
1155,uniforms cotton keara becerra uniform
1156,clothing athletic casual dress uniform wthr work youth soccer and coaches shirts glidan youth oz t shirt glidan oz jersey polo total youth soccer shirts and coaches shirts
1157,compound pipe joint screw pipe pt can rc ln qty del pf bo del date materials needed at glen bell warehouse
1158,clamps channel galvanized steel heavywall condu st elmo crawford
1159,sand and gravel material s industrial loads gem sandsz sm gem sandjohnsonj
1160,ethanol sun coast contract
1161,hardware accessories mounts patches plates sea ems toughbooks ems toughbooks
1162,application software microcomputer mobility enterprise for ios mobility license maintanence
1163,telephone switching pbx systems voip phones for code compliance at rbj
1164,wheel cutter rigid no standard thin rc ln qty del pf bo del date material needed at awgbsc
1165,top sheet top sheets ea per case per telecon with lynn at sss stretcher sheets
1166,chemicals bulk not otherwise itemized liquid sulfur dioxide ton cylinders cylinders deliver to walnut creek wwtp fm austin tx delivery date thursday for walnut creek
1167,trophies plaques awards etc not otherwise cla ae regional science fest awards order item column trphy marble columnlamp of knowledge placesf logo rightae logo leftsee attached ae regional science fest trophies
1168,shoes safety toe red wingsafety steel toe boots
1169,modular panel systems with metal connecting mech cushiondomino seat turnston austin ridge furniture rockford
1170,twoway radio supplies parts and accessories toro mower radio parts stock
1171,janitorial supplies general line broom push soft hair wo handle in generated by reorder am
1172,emulsions asphalt ergon
1173,gloves work mechanic synthetic leather sz xlarge rc ln qty del pf bo del date material needed at wbsc
1174,guns stun nonlethal xppm battery pack item at each taser equipment and accessories
1175,rain suit hooded woveralls yellow rc lnqty delpfbodel date material needed at awwbsc
1176,emulsions asphalt ergon asphalt and
1177,antennas and accessories amplifiers brackets ma wave ant titanium gray tessco see attached
1178,adult ambu spur oxygen resusictator per cs medical supplies
1179,exhaust system clamps exhaust pipes mufflers t parts for walkbehind airlesco
1180,monitors color and monochrome environmentally certified court
1181,network components adapter cards bridges connec req zilker pedistal req code compliance rbj floor
1182,hook arm grabber inch rc ln qty del pf bo del date material needed at gbsc
1183,links renewal for ren and res fuses fuse refill unit for switchgear amp holder fuse refill unit amp slow speed for pad mounted switchgear with sc type fuse holder on qpl replaces ae pn per ae fusing policy maintain as insurance per ae fusing policy critical materials supply arrangement
1184,irrigation systems supplies parts and accessori weathermatic spray heads weathermatic spray heads max
1185,adult adjustable c collar each per case ccollar adult ambu item number medical supplies
