,combined_text
406,transformers power distribution incl fluid fill transformer distribution single phase pole mount doe volt wire hv bushings with tank mounted arrester spec latest revision replaces critical materials supply arrangement
407,asphaltic concrete cold laid tons cold mix for pick up sidewalk projectswickersham waller and westgate richard bustos supervisor yds top soil r bustos
408,microcomputers handheld laptop and notebook quote ctm dell adapter usbc delivery address rutherford lane center co david barron rutherford lane north building police recruiting austin tx ctm laptops
409,application software microcomputer purchase of autocad licenses as per quote all terms and conditions governed under dir sdd debora anderson buyer i autodesk auto cad licenses
410,clothing jeans inv arc rated jeans gt distributors
411,posts sign steel square sleeve square unistrut posts and related items
412,towel paper c fold white rc ln qty del pf bo del date material neesded at awgbsc
413,cellular phones complete units brand listed or e zagg backlit keyboard folio att modems ipads with zagg x building services
414,magnesium hydroxide mag
415,sand and gravel delivery location to southeast service center s industrial loads gem sand sm gem sandjohnsonj
416,pole line hardware anchors arms bolts braces kv istring suspension insulator yclevis ball with corona ring as per spec and dwg jit at esdnorth per tracy breeding dkokas generated by reorder am
417,shirt uniform ls apd navy sz x firm order apd
418,television equipment and accessories hwstdtelevisionscustomer care
419,computer hardware and peripherals for microcompute hwstdsfp opticssean wilson
420,cutouts pole line type st elmo
421,coverall ls navy cotton largereg firm order coveralls
422,gloves ace contractorconcretesafety items edger saw blades
423,wrench combination in rc ln qty del pf bodel date delivery date shall be no later than grainger material for awwbsc
424,water distilled culligan deionized water service culligan deionized water service
425,rake garden in rc ln qty del pf bo del date weekly keepstock for webberville warehouse
426,biodiesel fuel sun coast contract
427,hiv testing kits and supplies alere determine agab combo item alere determine agab combo
428,hard hat suspension for cap and full brim style rc ln qty del pf bo del date material needed at wbsc
429,parts except engine helicopter repair ignition lead and airframe inspection service repair on cessna
430,battery penlight size aaa rc ln qty del pf bodel date delivery date shall be no later than msc material for glen bell warehouse
431,asphaltic concrete hot mix in accordance with it apac texas hot mix various sections
432,hydrant fire in way ft bury mj hydrant fire in way ft bury with mj glands must be shipped already assembled to bottom barrel shoe in accordance with spl material needed at gbsc
433,air conditioning and heating central units and p wall ac supply grille return air grille
434,freight and cargo containers shipping see class containers for aquatic sn mobile mini aquatic
435,steel reinforcing bars and rods bar steel concrete reinforcing round deformed x grade in accordance with astm revision all steel reinforcing supplied to the city of austin shall be listed on the approved producing mills that is maintained by the construction division of the state of texas department of transportation in qpl generated by reorder am
436,fingerprinting equipment accessories and supplie arson evidence cans one pint can with lid spex forensics supplies
437,twoway radio supplies parts and accessories thick mount tessco see attached
438,bits mar purchase of tile laminate adhesivewo
439,polish remover pad acetone free nail polish remover pad individually packaged pad approx x pad dynarex item number medical suuplies
440,freight and cargo containers shipping see class cpr supplies
441,laboratory gases argon carbon dioxide helium h instrument gas for lsd instrument gas for lsd
442,structural supports and racks mechanical type an dead end automatic with galvanized clevis strap and pin for solid copperweld conductors on qualified products list critical materials supply arrangement
443,conduit steel flexible greenfield type sleeve semitension compression type for triplex service cable acsr bare neutral messenger triplex service drop cable minimum length od prefilled with inhibitor ends covered with color coded caps on qualified products list critical materials supply arrangement
444,impact tools air powered not road building heavy duty onboard air system plus shipping fee onboard air system
445,supplies copier brand listed or equal x semi gloss paper rollsbox part number for noritsu digital dry photo printer supplies for digital dry photo printer
446,nameplates plastic metal desk holder ordered office name plate order for sworncivilian employees
447,software mainframe plot server latest version o fme server edition serial contract term requestor eshovo giwah fme server edition
448,fingerprinting equipment accessories and supplie forensicschemistry fingerprint supplies pk glassinesglassine envelope must be see through and breathable inches x packs of part no model spex forensics pk glassine envelope must be see through and breathable inches x packs of part no model spex forensics forensicschemistry fingerprint supplies
449,capacitors motor running oil filled capacitor bank preassy kvar volt insulation calss bil hz per ae specification this item has replaced item jit to stk st elmo per j kuykendallk hauer dp generated by reorder pm
450,grease lubrication type outgoing freight charges nordstrom grease davis wtp may
451,lighting fixtures outdoor floodlights spotlight luminiare watt high pressure sodium type iii distribution with volt regulated internally mounted ballast with pe control receptacle with universal type inch slip fitter all internal components shall be mounted to the housing as per specification dated january discontinued qpl purchased off specification american electric lighting pn generated by reorder pm
452,transformers power distribution incl fluid fill transformer distribution single phase pole mount doe volt wire hv bushings with tank mounted arrester spec dated replaces critical materials supply arrangement
453,sound analysis equipment and accessories noise me sound level meter accoustic calibrator gps unit wusb connection hand held sound meter with gps
454,cameras digital lcd best buyclayton craigcamera
455,bricks concrete brick common small bundles to be bundles to be secured by metal strapping masonry gravel and concrete supplies
456,impact tools air powered not road building home depotmike girod
457,conduit pvc schedule rigid in ft len spacer basefor conduit separation to lock vertically horizontally on qpl on qualified products list generated by reorder am
458,asphalt distributors levelers mixers crack seal parts pm and repair services
459,transformers power distribution incl fluid fill transformer distribution single phase pole mount doe volt wire hv bushings with tank mounted arrester spec dated replaces critical materials supply arrangement
460,cement portland lb sack generated by reorder pm
461,surveying systems software surveying software per invoice surveying software
462,transformers power distribution incl fluid fill transformer distribution single phase pole mount doe volt wire hv bushings with tank mounted arrester spec latest revision replaces critical materials supply arrangement
463,conduit and fittings cast iron and malleable iron conduit inch ridgid steel ft length hot dipped galvanized after threading in accordance with ansi specification c and ul approved on qualified products list note unit of measure changed from ea to ft generated by reorder am
464,cannula for iv sets x ml syringe bd blunt plastic cannula becton dickinson item number medical supplies
465,cotter pins clevis pins dowel pins spring pins cmcconcretedowels
466,trousers tactical poly rayon mens sz firm order for andy
467,locks key blanks and locksmith tools locksmith services mar duplicate keys wo
468,transformers power distribution incl fluid fill st elmo
469,conduit steel galvanized flexible liquidtite splices compression full tension for copper conductor on qualified products list critical materials supply arrangement
470,chairs guestside metal sled base this equipment shall be provided in accordance with furniture marketing group proposal no submitted by terri shellenberger on us communities contract no please contact rossy farinastrauss prior to placing this order very side seating w fabric seating
471,blocks fuse selfstripping type fuse link nema standard type n fit all amp inclusive on qualified products list to be used for street light onlyfor distribution applications use part per kc fagen critical materials supply arrangement
472,valve ball bronze stemchrome plated brass bal rc ln qty del pf bo del date material needed at awgbsc
473,broom push soft hair wo handle in rc ln qty del pf bo del date material for webberville store
474,pliers vise grip str jaw in rc ln qty del pf bo del date material needed at awgbsc
475,horseshoes horseshoe nails farrier tools and bl permanent farrier having surgery austin police mounted patrol horse service
476,installation supplies adhesive edge strip seam t electrical tape red tessco see attached
477,extinguisher fire dry chemical lb rc ln qty del pf bo del date material needed at awgbsc
478,valve gate brass in wheel type rc lnqty delpfbodel date material needed at wbsc
479,locks key blanks and locksmith tools locks for library
480,sprayer pump container rc ln qty del pf bo del date material needed at awwbsc
481,transformers power distribution incl fluid fill transformer distribution single phase pole mount doe volt wire hv bushings with tank mounted arrester spec dated replaces critical materials supply arrangement
482,guard rail galv x x gordon specialistguardrailsmike collier
483,installation supplies adhesive edge strip seam t electrical tape brown tessco see attached
484,street light poles and standards st light decorative pecan street style green high pressure sodium per ae dwg no and ae spec all hardware shall be stainless steel and tamper resistant not a warehouse item dynamic lighting pn generated by reorder am
485,twoway radio supplies parts and accessories pn tessco fews
486,lights emergency soundoff ghost led amber lone star products see attached
487,fittings and accessories vent pipe jaw sox spider
488,tools electricians and linemans including cabl fault indicator for to mcm cable for padmount equipment auto reset on time and current proximity immunity to at least at auto inrush restraint load tracking above ampselbo or cable mounted closed core uv protected hot stick applied must meet or exceed ansiieee standard packed two per carton in qpl generated by reorder am
489,insulators and parts pole line insulator deadendsuspension kv polymer type distribution class with tongue and clevis end fittings shall meet requirements of ieee on qualified products critical materials supply arrangement cmsa
490,books library bks ingram gf bks
491,twoway radio portable including vehicle radio r motorola apx portables model n qte motorola apx portables n
492,water cooler plastic wpressure fit lid gallons rc lnqty delpfbodel date material needed at awgbsc
493,bicycles tricycles etc for exercise bikes see repair treadmill at st requested by ralph repair treadmill st
494,shirt golf coa logo navy golf shirts bo
495,microcomputers desktop or towerbased quote buy board aww surface pro core
496,ear plug disposable rc ln qty del pf bo del date msc items for glen bell
497,wire bare copper kramer
498,headlight adjustable angle red led for map reading aaa ba rc lnqty delpfbodel date material needed at awgbsc
499,covers anchor bolt deadend formed wire strand copper color code green holding strength lbs on qualified products list generated by reorder pm
500,gun grease multiload no c rc ln qty del pf bo del date grainger weekly scan for glen bell warehouse
501,application software microcomputer adobe indesign indesign
502,cable power type xlpe cable power aluminum a wg conductor xlpe mil insulation full neutral per specification latest revision on qpl reel shall be nonreturnable wood with pressed in metal hub inch arbor hole this dimension must be maintained even with the use of the pressed in metal hub steel plate hubs are not accepted max flange measurement and max outside to outside measurement foot age shall be ft or critical materials supply arrangement cmsa
503,guy wires and cables guy strand sm hs ehs etc dispenser guywire safetypreformed units in a carton generated by reorder pm
504,computer hardware and peripherals for microcompute cisco power supply watt cdw qty requestor ray molina gabriela harthcock procurement specialist ii instant access poe switch w redundant ps capablity
505,impact tools air powered not road building w w grainger
506,xl nitrile glove prper box boxesper case rc ln qty del pf bo del date webberville qia items from msc
507,cable power type xlpe cable power aluminum a wg conductor xlpe insulation full neutral per specification latest revision on qpl reel shall be nonreturnable wood with pressed in metal hub or greater arbor hole steel plate hubs are not accepted max flange measurement and max outside to outside measurement foot age shall be ft or begin stocking per new dcs on critical materials supply arrangement
508,tape sealant teflon in x yds rc ln qty del pf bodel date delivery date shall be no later than grainger material for awgbsc
509,lumber hardwood all kinds ace contractorsdale fischerconstruction material
510,asphaltic concrete hot mix in accordance with it apac texas hot mix various sections
511,microcomputers desktop or towerbased tablets for awu
512,locks key blanks and locksmith tools padlock keyed for ae key only these locks can only be keyed by cothrons safe and lock in austin tx these locks are for use on distribution equipment such as airswitches and distribution switchgearcseries pop shackle multt lock key retaining clearance generated by reorder pm
513,books library bks ingram bks gf
514,trash pumps portable enginedriven trash pumpsfor field services s morrow
515,lights emergency soundoff ghost surface mount led lone star marketing see attached
516,head ear eye and face protection awu estimated annual amount safety glasses for tyrone bethel
517,extinguisher fire abc multipurpose powder with fire extinguishers
518,cocoa mix hot instant pack rc ln qty del pf bodel date grainger weekly order for webberville warehouse
519,bleach gal cont bleach gallon container note removed hazmat flag per g durante rb non stock per idle stock review lawrence byrd dbs generated by reorder pm
520,tires and tubes tires and tubes highway and off road tires and tubes
521,cpap system small adult otwo systems item cpap system small adult medical supplies emergency patient care for stock
522,street light poles and standards shoebox streetlight assembly this complete unit contains one foot black pole one black fixture one inch black arm one black hand hole cover and black pole cap in accordance with specification cardinal flower mr
523,band instruments and accessories megarity pipe chanter reed size medium pricing awarded through solicitation bagpipe materials accessories for honor guard
524,twoway radio supplies parts and accessories tessco tessco parts sns attached wdisc
525,asphaltic concrete hot mix in accordance with it apac texas hot mix various sections
526,parts and accessories flowmeter system free reagent set hach suppliesdavis wtpnov
527,fuses fuse blocks and holders links etc fuse link fitall amp cap bank ks on qpl critical materials supply arrangement
528,parts and accessories domestic water treatment chemical feed parts feb davis wtp chemical feed parts
529,monitors color and monochrome environmentally certified dell monitor aaa catalog number equote number contract pc monitors parks rec
530,bushings transformer terminal bushing plug kv for transformer bushing well load break on qualified products list critical materials supply arrangement
531,computer accessories and supplies cusstyplstc active dao quote contract laptops watershed protection
532,janitorial supplies general line gulf coast paper inc
533,cord ext wmoulded plug ft rc ln qty del pf bo del date msc for webberville store
534,transformers power distribution incl fluid fill transformer distribution single phase pole mount doe volt wire hv bushings with tank mounted arrester spec latest revision replaces critical materials supply arrangement cmsa
535,trouser uniform cotton nfpa men plain pockets afd replenishment backorders
536,automotive maintenance items and repairreplacemen auto parts for shop pms
537,models manikins and instructional aids chestskin mckellyals sim mannequin repairs
538,ties spool tie preformed for use on secondary conductors on qualified products list critical materials supply arrangement
539,clothing athletic casual dress uniform wthr work austin screen printing metz april austin screen printing shirts metz
540,lamps fluorescent preheat starter or pushbutto watt highpressure sodium lamp shall contain up to less mercury than a standard highpressure sodium lamp lamp shall include a welded leadfree brass base shall pass the existing federal tclp limits and be rated for hours life lamp shall be a direct retrofit on existing ansi designated ballasts of similar wattage of standard highpressure sodium lamps and shall meet existing ansi specifications for those corresponding wattages lamp shall have no more than the same warmup time and hot restrike time as a standard highpressure sodium lamp lamp shall be noncycling and shall remain off at the end of life and shall not cycle on qualified products list generated by reorder pm
541,conduit and fittings aluminum connector transformer tank grounding solid to stranded bronze shall accommodate unbroken ground wires side loading on qualified products list cross reference note replaces bill g critical materials supply arrangement
542,fittings welding equipment miller or equal ea drag shield miller pt ea miller plasma cutter fittings
543,freight and cargo containers shipping see class mobile mini monthly rental rosewood contract monthly rent mth aug rental of storage unit for
544,compound pipe joint screw pipe pt can rc lnqty delpfbodel date material neeeded at awgbsc
545,sand and gravel txigravel and sandconcrete
546,lights emergency front interior lightbar ford suv w cable tomar electronics see attached
547,aggregate gravel marble and stone chips etc f austin aggregatesbrad kirkwashed river rock loads
548,vests safety reflectorized vest safety high visibility lime green class ii fr size x large knit vest with hook loop front closure double left and single right chest pocket weighing oz per square yard with visibility standards in ansi and fr standards in astm silver reflective stripping shall be used for contrast vest are for workers who need greater visibility due to these factors potential bad weather vehicle or equipment speeds that exceed mph tasks that take attention away from traffic andor activities that take place close to traffic class ii vests provide protection for occupations that include crossing guard and airport ground crew general use only qpl safety vest lime green
549,lights emergency lamp lstick tomar for afd see attached
550,lights emergency lamp lstick tomar for afd see attached
551,raincoat pvcnylon wdet hood lime green in long small rc ln qty del pf bodel date delivery date shall be no later than msc qia material for awwbsc
552,nipple brass x in rc ln qty del pf bo del date material needed at awwbsc
553,short wheelbase twoand fourwheel drive vehicle abia buy board light duty package part of
554,floor maintenance machines parts and accessories repairs parts for floor equipment
555,cable type abam cablebare stranded wire before strandingshall be soft or annealed copper tin coated conforming before stranding to astm specifications for tinned soft or annealed lead coated and lead alloy coated and lead alloy coated soft copper wire latest edition all conductors sizes furnished under this specification shall have astm class a or class b stranding and shall be in accordance with edition specifications for concentrically stranded copper conductors on qualified products list reel shall be nonreturnable wood max flange measurement and max outside to outside width inch arbor hole this dimension must be maintained even with the use of the pressed in metal hub purchasing footage shall be ft critical materials supply arrangement
556,wheels and rims including wheel covers and hubcaps tire cover item tiresocks are used to protect finished flooring from scuff
557,wire bare copper type mhd wire bare mhd solid copper size packaging shall be lb hand coils approx ft on qualified products list critical materials supply arrangement
558,impact tools air powered not road building home depotmike girod
559,circuit breakers load centers boxes and panelbo conduit fittings conduit fittings walnut johnson
560,bolt hex head zinc x rc ln qty del pf bo del date material needed at wbsc
561,cable type abam cablebare stranded coppertinnedsoftbefore strandingshall be soft or annealed copper tin coated conforming before stranding to astm coated soft copper wire latest edition all conductors sizes furnished under this specification shall have astm class a or class b stranding and shall be in accordance astm latest editionspecifications for concen trically stranded copper conductors on qualified products list reel shall be nonreturnable wood max flange measurement and max outside to outside width measurement purchasing footage shall be ft specifications for tinned soft or annealed lead coated and lead alloy critical materials supply arrangement
562,medical dental and lab supply per price agreement ambu blue sensor sp electrodes medical supplies
563,soap liquid lotion type waterless hand cleaner
564,asphaltic concrete hot mix in accordance with it apac texas hot mix various sections
565,bandage knuckle x in fas rc ln qty del pf bodel date delivery date shall be no later than grainger material for webberville warehouse
566,rescue equipment supplies and accessories includi pr quote eclipse charger base ac adaptors attn brian kline bullard tic parts
567,paints traffic black traffic paint gal drum traffic paint for abia
568,janitorial supplies general line cleaning supplies and equipment
569,cable guy steel wire guy in extra high strength ftcoil galvanized class a this steel shall comply with astm latest revision applicable to the grades and sizes listed on qualified products list note this wire is available in feet csn critical materials supply arrangement cmsa
570,sprayers and spray systems industrial heavy duty tractor supplyspecial projskid mounted sprayer
571,police protection equipment body armor and riot s each hammer plastics round top and hat box item blk hammer plastics mfg sccblk each round top hat box
572,reducer ci mech jt mech jt x in rc ln qty del pf bo del date reducers needed for hornsby cip job
573,masimoinfant disp sensor lncs sensor infant kg masimo item number medical supplies
574,automotive accessories for automobiles buses tru sun coast contract
575,twoway radio supplies parts and accessories tessco freight tessco pn
576,cameras digital type incl digital network cameras the city of austin is seeking proposals from qualified vendors to provide a highresolution digital system for photographic images of red light violators at various intersections controlled by traffic signals within the city of austin the goal of the program is to reduce collisions and injuries related to red light running estimated per year with a yr contract totaling million redflex dec
577,lamps fluorescent incandescent mercury vapor q airfield replacement runway control system circuirt board airfield replacement runway control system circuirt board
578,sling nylon web ft rc ln qty del pf bo del date material needed at awbsc
579,shoes safety toe safety shoe distributors llp december payment
580,clothing athletic casual dress uniform wthr work refer to quote for details gildan adult heavy cotton oz short sleeve tshirt white gildan adult heavy cotton oz short sleeve tshirt white grand total lions and roy kizer resale golf shirts
581,conduit and fittings aluminum connector elbow load break with test point for kv cable concentric neutral urd cable kv molded rubber shielding on qualified products list critical materials supply arrangement
582,printers laser apd hp laserjet danielle lord apd hp laserjet danielle lord
583,books library purchase of adult and juvenile books ingram books gf
584,ticket vending machine traccards
585,patch texas department of health intermediate replaces firm order coa dept
586,nipple brass x in rc ln qty del pf bo del date material needed at wbsc
587,janitorial supplies general line gulf coast paper
588,lamps fluorescent incandescent mercury vapor q metal halide tube lamps for abia max po pr
589,twoway radio supplies parts and accessories motorola
590,jean blue mens size x blue jeans
591,shirt t ash ls size large firm orders coa
592,wrench pipe in rc lnqty delpfbodel date material needed at awwbsc
593,insecticide aerosol bomb oz rc ln qty del pf bodel date delivery date shall be no later than msc material for awwbsc
594,poles creosote treated st elmo lufkin cresoting
595,king system supraglottic airway kit red siz medical supplies
596,targets police targets x black white phototarget with scoring and command training circles csat targets
597,chlorine liquefied liquid chlorine and cylinders chlorine liquefied
598,asphaltic concrete cold laid cold mix asphalt ray andrews
599,knives pocket knife cable skinning generated by reorder am
600,mechanical pump and shaft seals spiral trac brushing counterclockwisecut ring
